{
  "schema": "nuvec-parity-record",
  "schema_version": 1,
  "created": "2026-10-23T16:02:33+00:00",
  "environment": {
    "machine": "Mac16,7",
    "chip": "Apple M4 Pro",
    "cpu_cores": {
      "performance": 10,
      "efficiency": 4
    },
    "gpu_cores": 20,
    "memory_bytes": 51539607552,
    "macos": {
      "version": "26.6.2",
      "build": "25G83"
    },
    "power": {
      "source": "ac",
      "low_power_mode": false
    },
    "swap_used_bytes_at_start": 14417657856,
    "nuvec": {
      "version": "0.4.0",
      "commit": "76ad586e4a669c9cdedc15075d74e7574c1dc592",
      "dirty": true
    },
    "rust": "rustc 1.99.0 (b940084d7 2026-09-28)",
    "mlx": "0.32.4",
    "mlx_lm": "0.32.2",
    "python": "3.13.12"
  },
  "settings": {
    "passes": 2,
    "runs_per_pass": 2,
    "max_tokens": 128,
    "prompt_tokens": [
      2048
    ],
    "legacy_repeats": [
      1,
      40,
      160
    ],
    "extra_prompt_tokens": {
      "mlx-community/Qwen3.6-35B-A3B-4bit": [
        32768,
        65536,
        261952
      ]
    },
    "concurrency": {
      "levels": [
        1,
        4,
        8
      ],
      "prompt_tokens": 512,
      "max_tokens": 128,
      "eos": "ignored"
    },
    "load": {
      "samples": 3,
      "first_token_prompt_tokens": 16,
      "cold_method": "sudo -n purge"
    },
    "memory": {
      "method": "peak_with_mapped-vs-get_peak_memory+ru_maxrss",
      "note": "nuvec counts mapped files whole; both engines copy unaligned (mlx-community) checkpoints once"
    },
    "gates": {
      "gate": 0.98,
      "goal": 1.0
    }
  },
  "sections": [
    "decode",
    "ttft",
    "memory",
    "load",
    "concurrency"
  ],
  "models": [
    {
      "id": "mlx-community/Qwen3-0.6B-4bit",
      "kind": "dense",
      "snapshot": "73e3e38d981303bc594367cd910ea6eb48349da8",
      "decode": [
        {
          "repeats": 1,
          "prompt_tokens": {
            "nuvec": 25,
            "mlx_lm": 25
          },
          "tok_s": {
            "nuvec": {
              "median": 432.40999999999997,
              "samples": [
                435.9,
                432.16,
                432.44,
                432.38
              ],
              "unit": "tok/s"
            },
            "mlx_lm": {
              "median": 393.73973161844293,
              "samples": [
                395.84081391574585,
                393.61883005703635,
                392.8740285970342,
                393.8606331798495
              ],
              "unit": "tok/s"
            },
            "ratio": 1.0982,
            "gate_pass": true,
            "goal_pass": true
          }
        },
        {
          "repeats": 40,
          "prompt_tokens": {
            "nuvec": 961,
            "mlx_lm": 961
          },
          "tok_s": {
            "nuvec": {
              "median": 347.69,
              "samples": [
                347.73,
                348.72,
                347.06,
                347.65
              ],
              "unit": "tok/s"
            },
            "mlx_lm": {
              "median": 319.53882561864305,
              "samples": [
                321.16817493695424,
                319.55969565141413,
                319.517955585872,
                318.62204745378654
              ],
              "unit": "tok/s"
            },
            "ratio": 1.0881,
            "gate_pass": true,
            "goal_pass": true
          }
        },
        {
          "repeats": 160,
          "prompt_tokens": {
            "nuvec": 3841,
            "mlx_lm": 3841
          },
          "tok_s": {
            "nuvec": {
              "median": 231.385,
              "samples": [
                231.96,
                231.45,
                231.32,
                230.69
              ],
              "unit": "tok/s"
            },
            "mlx_lm": {
              "median": 218.44879155343745,
              "samples": [
                218.23236936078195,
                218.66521374609297,
                219.35960812422755,
                216.959190123641
              ],
              "unit": "tok/s"
            },
            "ratio": 1.0592,
            "gate_pass": true,
            "goal_pass": true
          }
        }
      ],
      "ttft": {
        "legacy": [
          {
            "repeats": 1,
            "prompt_tokens": {
              "nuvec": 25,
              "mlx_lm": 25
            },
            "prefill_tok_s": {
              "nuvec": {
                "median": 2006.495,
                "samples": [
                  1976.95,
                  1973.57,
                  2036.04,
                  2081.61
                ],
                "unit": "tok/s"
              },
              "mlx_lm": {
                "median": 1675.5273863268358,
                "samples": [
                  1674.009094122676,
                  1705.4998750858256,
                  1677.0456785309955,
                  1659.4893752687508
                ],
                "unit": "tok/s"
              },
              "ratio": 1.1975,
              "gate_pass": true,
              "goal_pass": true
            }
          },
          {
            "repeats": 40,
            "prompt_tokens": {
              "nuvec": 961,
              "mlx_lm": 961
            },
            "prefill_tok_s": {
              "nuvec": {
                "median": 6192.54,
                "samples": [
                  6163.21,
                  6188.23,
                  6196.85,
                  6224.58
                ],
                "unit": "tok/s"
              },
              "mlx_lm": {
                "median": 5958.558895812921,
                "samples": [
                  5928.86595965054,
                  6013.751516019364,
                  5960.507759730196,
                  5956.610031895646
                ],
                "unit": "tok/s"
              },
              "ratio": 1.0393,
              "gate_pass": true,
              "goal_pass": true
            }
          },
          {
            "repeats": 160,
            "prompt_tokens": {
              "nuvec": 3841,
              "mlx_lm": 3841
            },
            "prefill_tok_s": {
              "nuvec": {
                "median": 4870.5,
                "samples": [
                  4874.91,
                  4873.98,
                  4862.63,
                  4867.02
                ],
                "unit": "tok/s"
              },
              "mlx_lm": {
                "median": 4765.180970132832,
                "samples": [
                  4771.419680558148,
                  4772.349451116936,
                  4758.942259707516,
                  4746.523820366896
                ],
                "unit": "tok/s"
              },
              "ratio": 1.0221,
              "gate_pass": true,
              "goal_pass": true
            }
          }
        ],
        "lengths": [
          {
            "prompt_tokens": 2048,
            "ttft_s": {
              "nuvec": {
                "median": 0.35814999999999997,
                "samples": [
                  0.3585,
                  0.3578,
                  0.3597,
                  0.3572
                ],
                "unit": "s"
              },
              "mlx_lm": {
                "median": 0.3703455419999955,
                "samples": [
                  0.3710947090003174,
                  0.36917658299353207,
                  0.3714220409965492,
                  0.36959637499967357
                ],
                "unit": "s"
              },
              "ratio": 1.0341,
              "gate_pass": true,
              "goal_pass": true
            },
            "prefill_tok_s": {
              "nuvec": {
                "median": 5718.344999999999,
                "samples": [
                  5712.23,
                  5724.46,
                  5693.88,
                  5733.47
                ],
                "unit": "tok/s"
              },
              "mlx_lm": {
                "median": 5529.9933395534745,
                "samples": [
                  5518.806790635887,
                  5547.480783839101,
                  5513.94309962081,
                  5541.1798884710615
                ],
                "unit": "tok/s"
              },
              "ratio": 1.0341,
              "gate_pass": true,
              "goal_pass": true
            }
          }
        ]
      },
      "memory": {
        "load": {
          "peak_bytes": {
            "nuvec": {
              "median": 335462400.0,
              "samples": [
                335462400,
                335462400
              ],
              "unit": "bytes"
            },
            "mlx_lm": {
              "median": 335380488.0,
              "samples": [
                335380488,
                335380488
              ],
              "unit": "bytes"
            },
            "ratio": 0.9998
          },
          "os_peak_rss_bytes": {
            "nuvec": {
              "median": 97935360.0,
              "samples": [
                98910208,
                96960512
              ],
              "unit": "bytes"
            },
            "mlx_lm": {
              "median": 696647680.0,
              "samples": [
                696582144,
                696713216
              ],
              "unit": "bytes"
            },
            "ratio": 7.1133
          },
          "nuvec_raw": {
            "peak_bytes": 0,
            "active_bytes": 0,
            "mapped_bytes": 335462400
          }
        },
        "decode": {
          "peak_bytes": {
            "nuvec": {
              "median": 376283392.0,
              "samples": [
                376389888,
                376176896
              ],
              "unit": "bytes"
            },
            "mlx_lm": {
              "median": 455278860.0,
              "samples": [
                455639312,